AtomicNumber,Element,Symbol,AtomicWeight,Period,Group,StandardState,MostStableCrystal,Type,IonicRadius,AtomicRadius,Electronegativity,FirstIonizationPotential,OxidationStates,Density,MeltingPointKelvin,BoilingPointKelvin,Isotopes,Discoverer,YearOfDiscovery,SpecificHeatCapacity,ElectronConfiguration,DisplayRow,DisplayColumn,Facts
94,Plutonium,Pu,244,7,23,Solid,mno,Actinide,0.89,,1.28,6.0262,"+6, +5, +4, +3",19.84,913.15,3501,163,"Glenn T. Seaborg, Edwin McMillan, Arthur Wahl, Joseph W. Kennedy",1940,,[Rn]7s2 5f6,9,8,"Plutonium is a radioactive actinide metal that was discovered in 1940 by Glenn T. Seaborg and Arthur Wahl. It was named after the planet Pluto, following the naming convention of planetary elements. Plutonium is primarily used as a fuel in nuclear reactors and in the production of nuclear weapons. The isotope plutonium-239 is particularly important because it is fissile, meaning it can sustain a chain reaction when exposed to neutrons. Plutonium’s discovery marked a significant milestone in nuclear chemistry and had far-reaching implications, particularly in the development of the atomic bomb. In addition to its use in weapons, plutonium-238 is used as a heat source for spacecraft, such as in radioisotope thermoelectric generators. Despite its uses, plutonium is highly toxic and radioactive, making it a major concern for nuclear safety, waste disposal, and environmental contamination. Its production, handling, and disposal are heavily regulated, and it remains a topic of both scientific research and political debate."
95,Americium,Am,243,7,24,Solid,hex,Actinide,0.98,,1.3,5.9738,"+6, +5, +4, +3",13.69,1267.15,2880,133,"Glenn T. Seaborg, Albert Ghiorso, Ralph A. James",1944,,[Rn]7s2 5f7,9,9,"Americium is a synthetic, radioactive actinide element that was first synthesized in 1944 by Glenn T. Seaborg and colleagues. It was named after the continent of America, following the tradition of naming elements after places (such as europium for Europe). Americium is best known for its use in smoke detectors, where the isotope americium-241 emits alpha particles that ionize the air in the detection chamber. This allows the detector to detect smoke particles that disrupt the ionization process, triggering an alarm. Americium-241 is also used in some types of radiation therapy, as its radiation can be used to target cancer cells. Due to its radioactivity, handling americium requires strict safety protocols to prevent exposure. Americium is produced in nuclear reactors through the irradiation of plutonium. It is one of the few elements that can be readily produced in small amounts for specific applications, although its use is highly regulated due to its radioactive properties. While it has limited industrial applications, its role in nuclear science and safety technologies is invaluable."
96,Curium,Cm,247,7,25,Solid,hex,Actinide,0.97,,1.3,5.9915,3,13.51,1340.15,3383,133,"Glenn T. Seaborg, Ralph A. James",1944,,[Rn]7s2 5f7 6d1,9,10,"Curium is a radioactive actinide metal that was discovered in 1944 by Albert Ghiorso, Glenn T. Seaborg, and Ralph A. James, and named in honor of Marie and Pierre Curie. Curium was the first transuranium element to be synthesized in significant quantities, and it was produced in the process of irradiating plutonium with neutrons. Curium has a range of isotopes, but curium-242 and curium-244 are the most significant. It is used in some nuclear reactors and has been studied for use in future nuclear power generation technologies, including in radioisotope thermoelectric generators that provide power for spacecraft. Curium's role in scientific research is primarily focused on its nuclear properties and its applications in understanding the behavior of actinides in nuclear reactions. The element is highly radioactive, making it dangerous to handle without specialized equipment, and is usually produced in small quantities. Though it has no widespread commercial applications due to its scarcity and radioactivity, curium is crucial in the study of nuclear reactions and the development of nuclear technologies."
97,Berkelium,Bk,247,7,26,Solid,hex,Actinide,0.95,,1.3,6.1979,"+4, +3",14.79,1259.15,983,83,"Glenn T. Seaborg, Albert Ghiorso",1949,,[Rn]7s2 5f9,9,11,"Berkelium is a synthetic, radioactive actinide element that was discovered in 1949 by Glenn T. Seaborg and his team at the University of California, Berkeley, where it was named after the university. It is produced by bombarding americium-241 with alpha particles. Berkelium is primarily used in nuclear research and is not found in nature, but is instead synthesized in small amounts in nuclear reactors or particle accelerators. The element has no significant industrial applications due to its scarcity and high radioactivity, but it plays a role in studying nuclear reactions and transuranium elements. Berkelium’s most notable isotopes are berkelium-249 and berkelium-247, which are used in experimental studies to explore nuclear properties and the behavior of heavy elements. The element is highly radioactive, and handling it requires special precautions to prevent exposure. While berkelium does not have significant practical uses outside of research, its discovery contributed to the development of the periodic table and the understanding of the actinide series."
98,Californium,Cf,251,7,27,Solid,hex,Actinide,0.93,,1.3,6.2817,3,15.1,1925.15,1173,123,"Glenn T. Seaborg, Albert Ghiorso",1950,,[Rn]7s2 5f10,9,12,"Californium is a radioactive actinide element discovered in 1950 by Albert Ghiorso, Glenn T. Seaborg, and others at the University of California, Berkeley. It was named after California, in honor of the university where it was first synthesized. Californium is produced by bombarding curium with neutrons and has several isotopes, with californium-252 being the most notable. Californium-252 is a strong neutron emitter and is used in neutron radiography, a non-destructive testing technique, as well as in neutron sources for research and medicine. The element is also used in some types of nuclear reactors, where it can act as a neutron source to start or sustain nuclear reactions. Californium is extremely rare and expensive to produce, making it mainly useful for specialized applications, particularly in scientific research and nuclear technologies. Its radioactivity and rarity limit its widespread use, but its neutron-emitting properties make it valuable in nuclear science and medical applications. Californium has also been considered for use in future nuclear reactors as a neutron initiator or for creating fuel for advanced reactors."
99,Einsteinium,Es,252,7,28,Solid,hex,Actinide,,,1.3,6.42,3,13.5,1133.15,,123,"Glenn T. Seaborg, Albert Ghiorso",1952,,[Rn]7s2 5f11,9,13,"Einsteinium is a synthetic, radioactive actinide element that was discovered in 1952 as a result of the first hydrogen bomb explosion. It was named after physicist Albert Einstein in recognition of his contributions to science, particularly in the field of nuclear physics. Einsteinium is produced by bombarding plutonium with neutrons in a nuclear reactor, and its most stable isotope, einsteinium-253, has a half-life of about 20 days. Due to its high radioactivity and scarcity, einsteinium has few practical applications outside of research, but it is used to study the behavior of heavy elements and nuclear reactions. Einsteinium is sometimes used as a source of neutrons in scientific experiments, and its isotopes have been investigated for use in nuclear reactors and space applications. However, its rarity and extreme radioactivity make it difficult to handle and limit its use in any commercial or medical applications. Einsteinium’s main contribution to science is in furthering the study of the actinide series and understanding nuclear processes."
100,Fermium,Fm,257,7,29,Solid,,Actinide,,,1.3,6.5,3,,,,103,"Glenn T. Seaborg, Albert Ghiorso",1953,,[Rn] 5f12 7s2,9,14,"Fermium is a synthetic, highly radioactive element that was discovered in 1952 by a team of scientists involved in the hydrogen bomb tests. It was named in honor of Enrico Fermi, one of the pioneers of nuclear physics. Fermium is produced by bombarding lighter elements such as uranium or plutonium with neutrons in a nuclear reactor or particle accelerator. Fermium has no practical applications outside of scientific research, and it is used primarily in the study of nuclear reactions and the synthesis of heavier elements. Fermium’s most stable isotope, fermium-257, has a half-life of approximately 100 days. It is an important part of the actinide series and is typically used in laboratory settings to investigate nuclear properties and understand the behavior of superheavy elements. Due to its rarity and the difficulty of isolating it, fermium does not have any significant industrial applications, but it remains valuable in advancing nuclear science. Its discovery and study helped extend the understanding of the nuclear structure and the synthesis of elements beyond uranium."
101,Mendelevium,Md,258,7,30,Solid,,Actinide,,,1.3,6.58,"+3, +2",,,,33,Glenn T. Seaborg,1955,,[Rn]7s2 5f13,9,15,"Mendelevium is a synthetic, highly radioactive element named after Dmitri Mendeleev, the Russian chemist who created the periodic table. It was first synthesized in 1955 by Albert Ghiorso, Glenn T. Seaborg, and their team at the University of California, Berkeley. Mendelevium is produced by bombarding einsteinium with alpha particles. This element has no significant commercial or industrial applications, and it is primarily used in nuclear research. Mendelevium's most stable isotope, mendelevium-258, has a half-life of around 51.5 days. The element is used to study the chemistry of the actinide series and to create heavier elements. Due to its extreme rarity, high radioactivity, and short half-life, mendelevium is not used in practical applications but plays a crucial role in the advancement of nuclear chemistry and atomic research. Mendelevium’s synthesis and study are important steps in the exploration of superheavy elements and their properties."
102,Nobelium,No,259,7,31,Solid,,Actinide,,,1.3,6.65,"+3, +2",,,,73,"Glenn T. Seaborg, Joint Institute for Nuclear Research",1958,,[Rn]7s2 5f14,9,16,"Nobelium is a synthetic, radioactive element named after Alfred Nobel, the inventor of dynamite and founder of the Nobel Prizes. It was first synthesized in 1958 by a team of Russian and Swedish scientists. Nobelium is produced by bombarding curium with carbon nuclei, resulting in a few atoms of the element. Due to its high radioactivity and scarcity, it has no significant practical applications outside of research. Nobelium’s most stable isotope, nobelium-259, has a half-life of approximately 58 minutes. The element is used in studies related to the synthesis of superheavy elements and nuclear reactions. Nobelium is a member of the actinide series, and its discovery has helped scientists understand the properties of elements in this group. Though it is primarily of interest to nuclear chemists and physicists, nobelium does not have widespread industrial or medical uses due to its limited availability and high radioactivity."
103,Lawrencium,Lr,262,7,32,Solid,,Actinide,,,,,3,,,,203,Lawrence Berkeley National Laboratory,1961,,[Rn]7s2 5f14 6d1,9,17,"Lawrencium is a synthetic element named after Ernest O. Lawrence, the inventor of the cyclotron, which made possible the acceleration of particles to create heavy elements. It was first synthesized in 1961 by Albert Ghiorso, Glenn T. Seaborg, and their team. Lawrencium is produced by bombarding smaller elements, such as californium, with ions. Its most stable isotope, lawrencium-257, has a half-life of approximately 27 seconds. Lawrencium is a member of the actinide series, and its properties are similar to those of other elements in this group. Due to its radioactivity and short half-life, lawrencium has no practical uses outside of scientific research. It plays a role in understanding the behavior of actinides and the synthesis of superheavy elements. Like many other synthetic elements, lawrencium is studied primarily for its atomic structure and its place in the periodic table, rather than for any commercial or industrial applications."
104,Rutherfordium,Rf,261,7,4,Solid,,Transition metal,,,,,4,18.1,,,,"Albert Ghiorso, Joint Institute for Nuclear Research",1969,,[Rn]7s2 5f14 6d2,7,4,"Rutherfordium is a synthetic, radioactive element named after physicist Ernest Rutherford, who is credited with discovering the atomic nucleus. It was first synthesized in 1964 by a team of scientists in the Soviet Union, though later experiments in the United States and Germany also confirmed its discovery. Rutherfordium is produced by bombarding californium with carbon nuclei. It has no practical uses outside of scientific research due to its extremely short half-life (its most stable isotope, rutherfordium-267, has a half-life of just over an hour). The element is studied primarily to understand the behavior of superheavy elements and nuclear chemistry. Rutherfordium is a member of the transactinide series, and its discovery was an important step in extending the periodic table beyond uranium. Research on rutherfordium and other superheavy elements helps scientists explore the boundaries of the periodic table and the fundamental principles of nuclear stability."
105,Dubnium,Db,262,7,5,Solid,,Transition metal,,,,,"5, 4, 3",39,,,,"Lawrence Berkeley National Laboratory, Albert Ghiorso, Joint Institute for Nuclear Research",1970,,[Rn]7s2 5f14 6d3,7,5,"Dubnium is a synthetic, radioactive element named after Dubna, Russia, the location of the Joint Institute for Nuclear Research where it was first synthesized. It was discovered in 1970 by scientists working in the Soviet Union, and its synthesis was later confirmed by teams in the United States and Germany. Dubnium is produced by bombarding californium with neon nuclei. Its most stable isotope, dubnium-268, has a half-life of just over 30 minutes. Like other superheavy elements, dubnium has no significant industrial or commercial uses due to its short half-life and radioactivity. It is primarily used for research in nuclear physics and chemistry, especially in the study of the actinide and transactinide series. The element's discovery expanded our understanding of the behavior of elements at the extreme end of the periodic table and helped set the stage for further studies of superheavy elements."
106,Seaborgium,Sg,266,7,6,Solid,,Transition metal,,,,,"6, 5, 4, 3, 0",35,,,,"Lawrence Berkeley National Laboratory, Albert Ghiorso",1974,,[Rn]7s2 5f14 6d4,7,6,"Seaborgium is a synthetic, radioactive element named in honor of Glenn T. Seaborg, the American chemist who contributed significantly to the discovery of transuranium elements. It was first synthesized in 1974 by a team of scientists at the Lawrence Berkeley National Laboratory. Seaborgium is produced by bombarding curium with oxygen nuclei. Its most stable isotope, seaborgium-271, has a half-life of about 2 minutes. Like many other superheavy elements, seaborgium is not used in industry or medicine due to its extreme radioactivity and short half-life. Instead, it is primarily studied in nuclear research to understand the properties of the heaviest known elements. Seaborgium's discovery helped to fill in gaps in the periodic table and provide new insights into the structure of matter at the atomic level."
107,Bohrium,Bh,264,7,7,Solid,,Transition metal,,,,,"7, 5, 4, 3",37,,,,"Peter Armbruster, Gottfried Münzenberg",1981,,[Rn]7s2 5f14 6d5,7,7,"Bohrium is a synthetic, radioactive element named after Danish physicist Niels Bohr, who made foundational contributions to atomic theory. It was first synthesized in 1987 by a team of German scientists at the Heavy Ion Research Facility in Darmstadt. Bohrium is produced by bombarding small amounts of the element bismuth with ions of chromium. Its most stable isotope, bohrium-270, has a half-life of around 61 seconds. Due to its highly radioactive nature and extremely short half-life, bohrium has no practical applications. It is studied primarily for research into the properties of superheavy elements and nuclear reactions. Bohrium's discovery was another milestone in the search for new elements and further expanded our understanding of nuclear physics and chemistry."
108,Hassium,Hs,267,7,8,Solid,,Transition metal,,,,,"8, 6, 5, 4, 3, 2",41,,,,"Peter Armbruster, Gottfried Münzenberg",1983,,[Rn]7s2 5f14 6d6,7,8,"Hassium is a synthetic, radioactive element named after the German state of Hesse, where it was first synthesized in 1984. It was produced by bombarding the element seaborgium with ions of calcium. Hassium's most stable isotope, hassium-277, has a half-life of about 11 seconds. Like other superheavy elements, hassium is highly unstable and is not used in any commercial applications. Its study provides valuable insights into the behavior of the heaviest elements and helps scientists understand the limits of the periodic table. Hassium is used mainly for research in nuclear physics and chemistry, particularly in the areas of element synthesis and the understanding of nuclear structure."
109,Meitnerium,Mt,268,7,9,Solid,,Transition metal,,,,,"9, 8, 6, 4, 3, 1",35,,,,"Peter Armbruster, Gottfried Münzenberg",1982,,[Rn]7s2 5f14 6d7 (calculated),7,9,"Meitnerium is a synthetic, radioactive element named after Lise Meitner, an Austrian-Swedish physicist who contributed to the discovery of nuclear fission. It was first synthesized in 1982 by a team of scientists at the GSI Helmholtz Centre for Heavy Ion Research in Germany. Meitnerium is produced by bombarding bismuth with ions of iron. Its most stable isotope, meitnerium-278, has a half-life of around 7.6 seconds. Like other superheavy elements, meitnerium is not used in practical applications due to its extreme radioactivity and short half-life. It is primarily studied in nuclear physics for its properties, which contribute to the understanding of the heaviest elements and nuclear reactions. Meitnerium’s discovery was part of the ongoing effort to extend the periodic table and push the limits of known chemistry."
110,Darmstadtium ,Ds ,271,7,10,Expected to be a Solid,,Transition metal,,,,,"8, 6, 4, 2, 0",,,,,Sigurd Hofmann,1994,,[Rn]7s2 5f14 6d8 (predicted),7,10,"Darmstadtium is a synthetic, radioactive element named after the German city of Darmstadt, where it was first synthesized in 1994. It was produced by bombarding nickel with ions of zinc. Darmstadtium's most stable isotope, darmstadtium-281, has a half-life of about 12.7 seconds. Due to its extreme instability, it has no practical uses outside of scientific research. Darmstadtium is studied for its nuclear properties and its position in the periodic table, helping scientists better understand the behavior of superheavy elements. Its discovery, along with the discovery of other elements in this range, has contributed to expanding knowledge in nuclear chemistry and physics, particularly regarding the limits of atomic number and the stability of heavy elements."
111,Roentgenium ,Rg ,272,7,11,Expected to be a Solid,,Transition metal,,,,,"5, 3, 1, -1",,,,,Sigurd Hofmann,1994,,[Rn]7s2 5f14 6d9 (predicted),7,11,"Roentgenium is a synthetic, radioactive element named after Wilhelm Röntgen, the German physicist who discovered X-rays. It was first synthesized in 1994 by a team of scientists at the GSI Helmholtz Centre for Heavy Ion Research in Germany. Roentgenium is produced by bombarding gold with ions of zinc. Its most stable isotope, roentgenium-282, has a half-life of about 2.1 minutes. Roentgenium has no practical applications due to its radioactivity and the difficulty of producing it in significant quantities. Like other superheavy elements, it is mainly studied in the context of nuclear research to understand the properties of these elements and the limits of the periodic table. Roentgenium’s discovery has expanded our understanding of the behavior of elements with very high atomic numbers and their potential for stability."
112,Copernicium ,Cn ,285,7,12,Expected to be a Solid,,Transition metal,,,,,"2, 1, 0",,,,,Sigurd Hofmann,1996,,[Rn]7s2 5f14 6d10 (predicted),7,12,"Copernicium is a synthetic, radioactive element named after the astronomer Nicolaus Copernicus, who formulated the heliocentric model of the solar system. It was first synthesized in 1996 by a team of scientists at the GSI Helmholtz Centre for Heavy Ion Research in Germany. Copernicium is produced by bombarding lead with ions of zinc. Its most stable isotope, copernicium-285, has a half-life of about 29 seconds. Copernicium does not have any practical applications due to its extreme radioactivity and the difficulty of producing it in large amounts. It is mainly used in nuclear research to study the properties of superheavy elements and to push the boundaries of atomic physics. Copernicium's discovery is significant in the context of exploring the theoretical limits of the periodic table and the stability of heavy elements."
113,Nihonium ,Nh ,284,7,13,Expected to be a Solid,,Post-transition metal,,,,,,,,,,Riken,2003,,[Rn]5f14 6d10 7s2 7p1 (predicted),7,13,"Nihonium is a synthetic, radioactive element named after Japan (from the Japanese word ""Nihon,"" meaning Japan). It was first synthesized in 2004 by a team of Japanese scientists at the RIKEN Nishina Center for Accelerator-Based Science. Nihonium is produced by bombarding bismuth with zinc ions. Its most stable isotope, nihonium-286, has a half-life of about 10 seconds. Nihonium does not have practical applications outside of scientific research due to its radioactivity and the difficulty in producing enough of it. It is studied primarily for its properties in the context of nuclear chemistry and physics, particularly in understanding the behavior of superheavy elements and the limits of the periodic table. Nihonium’s discovery represents a significant achievement in the study of synthetic elements, as it was the first element to be confirmed by a Japanese research team."
114,Flerovium ,Fl ,289,7,14,Expected to be a Solid,,Post-transition metal,,,,,"6, 4,2, 1, 0",,,,,"Joint Institute for Nuclear Research, Sigurd Hofmann, Flerov Laboratory of Nuclear Reactions",1998,,[Rn]7s2 7p2 5f14 6d10 (predicted),7,14,"Flerovium is a synthetic, radioactive element named after the Russian physicist Georgy Flerov, who was instrumental in the development of the study of superheavy elements. It was first synthesized in 1998 by a team of scientists at the Joint Institute for Nuclear Research in Dubna, Russia. Flerovium is produced by bombarding plutonium with calcium ions. Its most stable isotope, flerovium-289, has a half-life of about 2.6 seconds. Flerovium has no practical applications due to its extreme radioactivity and short half-life. Like other superheavy elements, it is studied primarily for its nuclear properties and to explore the stability of elements at the end of the periodic table. Flerovium’s discovery contributes to the broader effort of understanding the structure and stability of superheavy nuclei and pushes the boundaries of known chemistry."
115,Moscovium ,Mc ,288,7,15,Expected to be a Solid,,Post-transition metal,,,,,"3, 1",,,,,"Joint Institute for Nuclear Research, Sigurd Hofmann, Flerov Laboratory of Nuclear Reactions",2003,,[Rn]7s2 7p3 5f14 6d10 (predicted),7,15,"Moscovium is a synthetic, radioactive element named after Moscow, Russia. It was first synthesized in 2004 by a team of scientists from Russia and the United States at the Joint Institute for Nuclear Research in Dubna, Russia. Moscovium is produced by bombarding americium with calcium ions. Its most stable isotope, moscovium-288, has a half-life of about 220 milliseconds. Moscovium has no practical uses due to its extreme radioactivity and the fact that only tiny amounts have been produced. It is primarily studied in nuclear physics and chemistry to help scientists understand the properties of superheavy elements and explore the boundaries of the periodic table. The discovery of moscovium and its cousins in the superheavy element group continues to fuel interest in the synthesis of elements beyond uranium and the exploration of nuclear stability."
116,Livermorium ,Lv ,292,7,16,Expected to be a Solid,,Post-transition metal,,,,,"+4, +2, -2",,,,,Joint Institute for Nuclear Research,2000,,[Rn]7s2 7p4 5f14 6d10 (predicted),7,16,"Livermorium is a synthetic, radioactive element named after Lawrence Livermore National Laboratory in California, in recognition of the contributions of the laboratory to the study of superheavy elements. It was first synthesized in 2000 by a team of scientists at the Joint Institute for Nuclear Research in Dubna, Russia, and Lawrence Livermore National Laboratory in the United States. Livermorium is produced by bombarding tennessine with calcium ions. Its most stable isotope, livermorium-293, has a half-life of about 60 milliseconds. Livermorium has no practical applications outside of research due to its extreme instability and radioactivity. It is studied primarily for its nuclear properties and its place in the periodic table, helping to expand the understanding of the behavior of superheavy elements."
