AtomicNumber,Element,Symbol,AtomicWeight,Period,Group,StandardState,MostStableCrystal,Type,IonicRadius,AtomicRadius,Electronegativity,FirstIonizationPotential,OxidationStates,Density,MeltingPointKelvin,BoilingPointKelvin,Isotopes,Discoverer,YearOfDiscovery,SpecificHeatCapacity,ElectronConfiguration,DisplayRow,DisplayColumn,Facts
28,Nickel,Ni,58.6934,4,10,Solid,fcc,Transition metal,0.69,1.6,1.91,7.6398,"+3, +2",8.912,1726.15,3186,11,Axel Fredrik Cronstedt,1751,0.444,[Ar]4s2 3d8,4,10,"Nickel is a silvery-white metal that is highly resistant to corrosion and oxidation, making it ideal for use in coins, batteries, and various industrial applications. It is a key component in the production of stainless steel, where it enhances the metal's strength and resistance to corrosion. Nickel is also used in the manufacture of rechargeable batteries, particularly nickel-cadmium (NiCd) and nickel-metal hydride (NiMH) batteries. It is an essential trace element for humans, playing a role in enzyme activity and the regulation of metabolic processes. Nickel is obtained from ores like laterite and pentlandite and is also found in meteorites. Due to its resistance to corrosion, nickel is used in marine environments, such as in the production of ship parts, and in chemical industries where it is used as a catalyst."
29,Copper,Cu,63.546,4,11,Solid,fcc,Transition metal,0.73,1.6,1.9,7.7264,"+2, +1",8.96,1357.75,2835,11,Prehistoric,,0.385,[Ar]4s1 3d10,4,11,"Copper is a reddish-brown metal that is an excellent conductor of electricity and heat, making it a vital component in electrical wiring, electronics, and plumbing. It is also used in the production of alloys like bronze (copper and tin) and brass (copper and zinc), which have various applications in machinery, architecture, and coinage. Copper has been used by humans for thousands of years, and ancient civilizations used it to create tools, weapons, and art. Copper is an essential trace element in the human diet, as it plays a role in iron metabolism, immune function, and the formation of red blood cells. The element is found in ores such as chalcopyrite and malachite and is primarily extracted through smelting. Copper's antimicrobial properties make it useful in medical and sanitation applications, such as door handles and surgical instruments."
30,Zinc,Zn,65.38,4,12,Solid,hex,Transition metal,0.74,1.5,1.65,9.3942,2,7.134,692.88,1180,15,Andreas Sigismund Marggraf,,0.388,[Ar]4s2 3d10,4,12,"Zinc is a bluish-white metal that is primarily used in galvanization, the process of coating iron or steel with zinc to prevent rusting. Zinc is also an important element in batteries, including zinc-carbon and alkaline batteries, and plays a key role in the production of alloys such as brass. Zinc is essential for human health, as it supports immune function, wound healing, and DNA synthesis. It is commonly found in foods such as meat, shellfish, legumes, and seeds. Zinc is also used in the production of rubber, chemicals, and fertilizers. The element is primarily extracted from ores like sphalerite and is commonly used in die-casting and in the manufacture of sunscreen. Zinc's role in galvanization and corrosion prevention makes it one of the most important metals in industrial applications."
31,Gallium,Ga,69.723,4,13,Solid,orth,Post-transition metal,0.62,1.8,1.81,5.9993,3,5.907,302.91,2477,14,Paul-Émile Lecoq de Boisbaudran,1875,0.371,[Ar]4s2 3d10 4p1,4,13,"Gallium is a soft, silvery metal that is known for its ability to remain in a liquid state just above room temperature, which makes it valuable for specific applications in electronics and semiconductors. It is primarily used in the production of light-emitting diodes (LEDs) and in solar panels, where it is part of gallium arsenide (GaAs) compounds that have excellent efficiency in converting solar energy. Gallium is also used in the creation of high-speed electronics and optical devices, such as laser diodes. Gallium is non-toxic and does not occur naturally in its pure form, but it is extracted as a byproduct of mining aluminum and zinc ores. In addition to its use in electronics, gallium is being explored for use in quantum computing and thermoelectrics. It is also used in medical imaging and as a component in certain types of radiation therapy."
32,Germanium,Ge,72.64,4,14,Solid,fcc,Metalloid,0.53,1.5,2.01,7.8994,"+4, +2",5.323,1211.45,3106,17,Clemens Winkler,1886,0.32,[Ar]4s2 3d10 4p2,4,14,"Germanium is a brittle, grayish-white metalloid with semiconductor properties, making it an important material in the electronics and telecommunications industries. It is used to make transistors and diodes, and it has applications in fiber-optic communications, infrared optics, and solar cells. Germanium is often alloyed with silicon to improve the performance of integrated circuits, especially in high-frequency electronics. The element was crucial in the development of early transistor technology, earning it the nickname ""the silicon of the 1940s."" While it is less abundant than silicon, germanium is still used in optoelectronics, including in infrared cameras and night-vision devices. Germanium is primarily obtained as a byproduct of zinc and copper mining. It is also used in the production of polymerization catalysts and in some types of glass."
33,Arsenic,As,74.9216,4,15,Solid,rho,Metalloid,0.58,1.3,2.18,9.7886,"+5, +3, -3",5.776,1090.15,887,14,Albertus Magnus,1250,0.329,[Ar]4s2 3d10 4p3,4,15,"Arsenic is a highly toxic metalloid that is known for its use in pesticides, herbicides, and in the preservation of wood, though its use has been limited due to its toxicity. It can exist in several allotropes, with gray arsenic being the most stable form. Arsenic is found in trace amounts in the Earth's crust and is typically obtained from minerals such as arsenopyrite. Inorganic arsenic compounds, like arsenic trioxide, have been historically used in medicine, but they are highly poisonous. Despite its toxicity, arsenic is used in the production of semiconductors, particularly in gallium arsenide (GaAs), for high-performance devices like solar cells, light-emitting diodes (LEDs), and lasers. Chronic exposure to arsenic can lead to serious health issues, including skin lesions, cancer, and cardiovascular disease. As a result, strict regulations govern its use in many countries."
34,Selenium,Se,78.96,4,16,Solid,hex,Nonmetal,0.5,1.2,2.55,9.7524,"+6, +4, -2",4.809,494.15,958,20,"Jöns Jacob Berzelius, Johan Gottlieb Gahn",1817,0.321,[Ar]4s2 3d10 4p4,4,16,"Selenium is a non-metal that plays an essential role in human health, particularly in antioxidant enzymes that protect cells from oxidative stress. It is found in trace amounts in soil and is commonly present in foods like Brazil nuts, seafood, and grains. Selenium is crucial for the functioning of the thyroid and immune system, and it helps prevent damage to cells from free radicals. It is also used in the electronics industry to make rectifiers and photocells, as it is a semiconductor material. Selenium compounds are used in glass production to decolorize glass and in the manufacture of pigments. While selenium is necessary for health in small quantities, excessive exposure can be toxic, leading to conditions like selenosis, which causes symptoms such as hair loss and gastrointestinal issues. Selenium is often found in combination with metals like mercury and arsenic in natural deposits."
35,Bromine,Br,79.904,4,17,Liquid,,Halogen,2,1.1,2.96,11.8138,"+5, +1, -1",3.122,266.05,332,19,"Antoine Jérôme Balard, Carl Jacob Löwig",1826,0.474,[Ar]4s2 3d10 4p5,4,17,"Bromine is a reddish-brown liquid at room temperature and is the only nonmetallic element that is liquid at standard conditions. It is highly reactive and is used in various industrial applications, including the production of flame retardants, fumigants, and agricultural chemicals. Bromine is used in the manufacture of certain dyes and is also a component in disinfectants for swimming pools and water treatment. In organic chemistry, bromine is used as a reagent for the synthesis of a wide range of compounds, including pharmaceuticals and plastics. Bromine compounds, such as methyl bromide, have been used as pesticides, although their use has been heavily restricted due to their harmful effects on the ozone layer. Bromine is primarily obtained from seawater and brine wells and is present in trace amounts in the Earth’s crust."
36,Krypton,Kr,83.798,4,18,Gas,,Noble gas,,1,,13.9996,0,0.003733,115.93,119.93,23,"William Ramsay, Morris Travers",1898,0.248,[Ar]4s2 3d10 4p6,4,18,"Krypton is a colorless, odorless, inert gas that belongs to the noble gases group in the periodic table. It is rare in Earth's atmosphere, comprising only about 0.0001% of it. Krypton is used in some types of high-performance light bulbs, including certain types of photographic flashes and in the production of energy-efficient lighting, where it helps improve the efficiency and brightness of the bulbs. It is also used in the field of spectroscopy to measure the concentration of certain substances. Krypton is not reactive under most conditions, but it can form compounds with highly electronegative elements like fluorine. Due to its scarcity and limited industrial uses, krypton is not widely known but is still important in scientific research and specialized lighting applications. Krypton was discovered in 1898, and its name is derived from the Greek word kryptos, meaning ""hidden."""
37,Rubidium,Rb,85.4678,5,1,Solid,bcc,Alkali metal,1.5,3,0.82,4.1771,1,1.532,312.79,961,20,"Gustav Kirchhoff, Robert Bunsen",1861,0.363,[Kr]5s1,5,1,"Rubidium is a soft, silvery-white alkali metal that is highly reactive, particularly with water. It is one of the least abundant alkali metals and is found in trace amounts in the Earth's crust. Rubidium is used in research and development, particularly in atomic clocks and in the study of quantum mechanics. Its compounds, such as rubidium chloride, are used in specialty glasses and in the production of certain catalysts. Rubidium vapor is used in some types of ion engines for spacecraft propulsion. Due to its high reactivity, rubidium must be stored in inert gases like argon or under oil to prevent it from reacting with moisture in the air. While rubidium has few practical applications, its unique properties make it useful in scientific experiments, particularly in atomic and molecular research."
38,Strontium,Sr,87.62,5,2,Solid,fcc,Alkaline earth metal,1.1,2.5,0.95,5.6949,2,2.64,1042.15,1655,18,"Humphry Davy, Adair Crawford, William Cruickshank",1808,0.301,[Kr]5s2,5,2,"Strontium is a soft, silvery metal that belongs to the alkaline earth metals group. It is widely used in the production of fireworks and flares to create red-colored flames. Strontium compounds are also used in the manufacture of magnets and in medical applications, such as in the treatment of bone disorders. Strontium-90, a radioactive isotope, is a byproduct of nuclear fission and has been used in power sources for remote applications like satellites and pacemakers. Strontium is naturally found in minerals like celestite and is extracted through mining and refining. It is also used in the production of certain types of glass, including the glass for cathode ray tubes in old television sets. While strontium is essential in trace amounts for human health, particularly in bone formation, exposure to high levels of strontium-90 can pose health risks."
39,Yttrium,Y,88.90585,5,3,Solid,hex,Transition metal,0.9,2.3,1.22,6.2173,3,4.469,1799.15,3609,21,Johan Gadolin,1794,0.298,[Kr]5s2 4d1,5,3,"Yttrium is a soft, silvery metal that is commonly used in the electronics industry, particularly in the production of superconductors and semiconductors. It is a key component in the production of phosphors used in color television tubes and LED lights. Yttrium is also used in the manufacture of high-temperature superconducting materials, which are important for developing more efficient energy transmission and powerful magnets. Yttrium is found in rare-earth minerals like monazite and xenotime and is extracted primarily from these ores. The metal is named after the Swedish village of Ytterby, where the mineral was first discovered. While yttrium itself has no significant biological role, its compounds are used in medical imaging and in radiation therapy for certain types of cancer."
40,Zirconium,Zr,91.224,5,4,Solid,hex,Transition metal,0.72,2.2,1.33,6.6339,4,6.506,2125.15,4682,20,Martin Heinrich Klaproth,1789,0.278,[Kr]5s2 4d2,5,4,"Zirconium is a strong, silvery-gray metal that is highly resistant to corrosion, making it ideal for use in environments that are exposed to high temperatures or aggressive chemicals. It is commonly used in the production of nuclear reactors, as it is a key component in the cladding of fuel rods due to its ability to withstand radiation and high heat. Zirconium is also used in the production of high-performance ceramics, including those used in aerospace and medical applications. The metal is primarily obtained from the mineral zircon and is also used in the manufacture of certain types of glass. Zirconium alloys are widely used in industries like chemical processing and in the production of catalysts. Despite being a relatively rare metal, zirconium’s unique properties have made it an essential material in a range of high-tech and industrial applications."
41,Niobium,Nb,92.90638,5,5,Solid,bcc,Transition metal,0.69,2.1,1.6,6.7589,"+5, +3",8.57,2741.15,5017,24,Charles Hatchett,1801,0.265,[Kr]5s1 4d4,5,5,"Niobium is a soft, gray, and ductile metal that is primarily used in superconducting materials and as an alloying element in steel. Its superconducting properties are especially valuable in high-energy physics experiments and medical equipment like MRI machines. Niobium was discovered in 1801 by Charles Hatchett, but it wasn’t until the 20th century that its commercial applications began. It is often found in minerals like columbite and pyrochlore. Niobium’s use in alloys helps enhance the strength and corrosion resistance of steel, especially in the construction of pipelines and bridges. The element is also being researched for use in quantum computing due to its superconducting properties at low temperatures. Niobium shares chemical similarities with another metal, Tantalum."
42,Molybdenum,Mo,95.96,5,6,Solid,bcc,Transition metal,0.65,2,2.16,7.0924,6,10.22,2890.15,4912,20,Carl Wilhelm Scheele,1778,0.251,[Kr]5s1 4d5,5,6,"Molybdenum is a hard, silvery-gray metal with a high melting point, making it ideal for use in steel alloys, particularly in aerospace and automotive applications. It is an essential trace element for living organisms, though only in small amounts. Molybdenum’s resistance to corrosion and high temperatures has made it vital for use in power plants and chemical processing. It is used in producing steel, where it increases strength, toughness, and resistance to wear. Its discovery dates back to the late 18th century, and it is named after the Greek word “molybdos,” meaning lead, because of its similarity to lead ores. Molybdenum is also involved in the biological processes of certain bacteria, where it plays a crucial role in nitrogen fixation. Its use in high-performance metal alloys is vital for the aerospace industry, and it is often found in products like turbine blades and military vehicles."
43,Technetium,Tc,98,5,7,Solid,hex,Transition metal,0.56,2,1.9,7.28,"+7, +6, +4",11.5,2473.15,5150,23,"Emilio Segrè, Carlo Perrier",1937,,[Kr]5s2 4d5,5,7,"Technetium is a radioactive element and was the first to be artificially produced in 1937 by Italian scientists Carlo Perrier and Emilio Segrè. It has no stable isotopes and is a byproduct of nuclear reactors. Technetium is most famous for its use in medical imaging, particularly in nuclear medicine, where it is used in radiopharmaceuticals for scanning organs and tissues. It is used in a variety of diagnostic procedures, including bone scans and heart imaging. Because of its high radioactivity, technetium must be handled with care, and it decays into stable isotopes over time. The element is also found in trace amounts in certain stars, formed during the process of nucleosynthesis. Technetium's role in nuclear science has been fundamental in advancing both medical and scientific research."
44,Ruthenium,Ru,101.07,5,8,Solid,hex,Transition metal,0.68,1.9,2.2,7.3605,3,12.37,2523.15,4423,16,Karl Ernst Claus,1844,0.238,[Kr]5s1 4d7,5,8,"Ruthenium is a rare, silvery-white metal belonging to the platinum group of elements. It is highly resistant to corrosion and is used in various industrial applications, including electrical contacts, hydrogenation reactions, and in catalytic converters. Ruthenium's discovery in 1844 by the Russian chemist Karl Ernst Claus contributed to the understanding of the platinum group metals. It is often used as a catalyst in chemical reactions, especially in the petroleum industry. Ruthenium is also critical in the electronics industry, where it is employed to make contacts and components that can withstand high temperatures. While it is not as widely known as platinum, ruthenium plays an important role in reducing pollutants in vehicle emissions and in several industrial chemical processes. Ruthenium is used in jewelry for its durability and reflective properties, and its compounds are also studied for potential use in cancer treatment."
45,Rhodium,Rh,102.9055,5,9,Solid,fcc,Transition metal,0.68,1.8,2.28,7.4589,3,12.41,2239.15,3968,20,William Hyde Wollaston,1803,0.243,[Kr]5s1 4d8,5,9,"Rhodium is a rare, silvery-white metal that is known for its high reflectivity and corrosion resistance. It is one of the most valuable and rare metals on Earth, often used in automotive catalytic converters to reduce harmful emissions. Rhodium is part of the platinum group of metals and is used as a catalyst in chemical reactions, particularly in hydrogenation and hydroformylation. It is also used in the production of jewelry due to its shine and resistance to tarnish. The metal is often alloyed with platinum and palladium to enhance its durability and appearance. Rhodium was discovered in 1803 by William Hyde Wollaston, who isolated it from platinum ores. Despite its rarity, rhodium’s applications in industrial and environmental processes make it highly sought after, particularly in the automotive and manufacturing industries."
46,Palladium,Pd,106.42,5,10,Solid,fcc,Transition metal,0.86,1.8,2.2,8.3369,"+3, +2",12.02,1825.15,3236,21,William Hyde Wollaston,1803,0.244,[Kr]4d10,5,10,"Palladium is a soft, silvery-white metal that is used in a variety of applications, from automotive catalytic converters to electronics and jewelry. It is part of the platinum group of metals and is known for its ability to absorb hydrogen, making it useful in hydrogen storage and purification technologies. Palladium was discovered in 1803 by William Hyde Wollaston, and its name is derived from the asteroid Pallas. In addition to its use in catalytic converters, palladium is important in the manufacturing of fuel cells and as a catalyst in the chemical industry, particularly in hydrogenation reactions. It is also used in jewelry and watches due to its lustrous appearance and hypoallergenic properties. Palladium's ability to absorb large amounts of hydrogen without altering its structure has made it vital in research for future clean energy solutions."
47,Silver,Ag,107.8682,5,11,Solid,fcc,Transition metal,1.3,1.8,1.93,7.5762,1,10.501,1234.15,2435,27,Prehistoric,,0.235,[Kr]5s1 4d10,5,11,"Silver is one of the most well-known precious metals, valued for its beauty and rarity. It has been used for thousands of years in currency, jewelry, and tableware. Silver is an excellent conductor of electricity and heat, making it indispensable in electronics, solar panels, and batteries. Its antimicrobial properties are utilized in medical devices, wound dressings, and water purification systems. Historically, silver was used in coinage and as a standard for monetary systems. The element’s name comes from the Latin word “argentum,” meaning “white” or “shiny,” reflecting its bright luster. Silver is also involved in chemical processes as a catalyst and is used in the production of mirrors due to its reflective properties. Silver is less abundant than gold, but it remains highly valuable, with demand driven by both industrial and aesthetic uses."
48,Cadmium,Cd,112.411,5,12,Solid,hex,Transition metal,0.97,1.7,1.69,8.9938,2,8.69,594.33,1040,22,"Friedrich Stromeyer, Karl Samuel Leberecht Hermann",1817,0.232,[Kr]5s2 4d10,5,12,"Cadmium is a soft, bluish-white metal that is toxic and poses environmental and health risks. It is primarily used in rechargeable batteries, particularly in nickel-cadmium (NiCd) batteries, which were commonly used in portable electronics and power tools. Cadmium is also found in pigments, coatings, and in some plastic stabilizers. The element’s high toxicity is of major concern, especially in its exposure through soil, water, and air pollution. It is associated with kidney damage, lung cancer, and bone demineralization when inhaled or ingested in large quantities. Due to its environmental impact, the use of cadmium in products like batteries is being phased out in many countries, with alternatives such as lithium-ion batteries taking its place. In industrial settings, cadmium is used in the production of solar panels, but it requires careful handling and disposal due to its harmful effects. Despite these concerns, cadmium still has niche uses in certain industries, though its potential for harm continues to raise alarms."
49,Indium,In,114.818,5,13,Solid,tet,Post-transition metal,0.8,2,1.78,5.7864,3,7.31,429.91,2345,34,Ferdinand Reich,1863,0.233,[Kr]5s2 4d10 5p1,5,13,"Indium is a soft, silvery-white metal with a low melting point and excellent corrosion resistance. It is primarily used in the production of flat-panel displays, including liquid crystal displays (LCDs) and touchscreens, where it is alloyed with tin to form indium tin oxide (ITO). This compound is crucial for making transparent conductive films used in displays and solar cells. Indium is also used in the electronics industry for soldering materials and semiconductors. The metal’s discovery dates back to 1863, and it was named after the indigo color of its spectral lines. Indium’s applications are growing due to the rise in demand for electronic devices and renewable energy technologies. Although it is rare in the Earth's crust, indium is often recovered as a byproduct of zinc mining. It is also used in high-performance bearings and as a component in some alloys designed for low-temperature use."
50,Tin,Sn,118.71,5,14,Solid,tet,Post-transition metal,0.69,1.7,1.96,7.3439,"+4, +2",7.287,505.21,2875,28,Prehistoric,,0.228,[Kr]5s2 4d10 5p2,5,14,"Tin is a soft, silvery-white metal known for its corrosion resistance and low melting point. Historically, it has been used since ancient times in the production of bronze, an alloy of copper and tin that was pivotal in early tool and weapon making. Today, tin is primarily used in the form of tinplate for coating steel, as well as in solders, particularly for electronics. Tin has excellent ductility and is highly resistant to corrosion, making it ideal for food cans and roofing materials. It also plays a key role in the production of various alloys, such as solder (a mixture of tin and lead, although lead-free solders are increasingly used). The element is also used in the manufacturing of glass, especially for producing mirrors. Tin's low toxicity has made it a safer alternative in many applications where lead was once used. Its symbol, ""Sn,"" comes from the Latin word ""stannum,"" which was used for the metal in ancient times."
51,Antimony,Sb,121.76,5,15,Solid,rho,Metalloid,0.76,1.5,2.05,8.6084,"+5, +3, -3",6.685,904.05,1860,29,Early historic times,,0.207,[Kr]5s2 4d10 5p3,5,15,"Antimony is a metalloid with a gray, lustrous appearance and is often used in flame retardants, lead alloys, and batteries. It has been known since ancient times and was used by the Egyptians as an eye makeup, known as kohl. Antimony compounds are also used in the manufacture of semiconductors, where they help improve the performance of components like diodes and transistors. It is primarily used in alloys, where it strengthens lead and makes it more durable and less prone to corrosion. Although it has limited industrial uses, antimony is also a critical component in the production of batteries, especially in the lead-antimony batteries used in backup power supplies. Its toxicity, particularly in its trivalent form, has led to concerns about its environmental impact and worker safety. Despite this, antimony’s applications in electronics, military technology, and batteries make it a valuable resource in several high-tech industries. Its name comes from the Greek word ""anti"" (not) and ""monos"" (alone), reflecting its unusual chemical properties when isolated in pure form."
