AtomicNumber,Element,Symbol,AtomicWeight,Period,Group,StandardState,MostStableCrystal,Type,IonicRadius,AtomicRadius,Electronegativity,FirstIonizationPotential,OxidationStates,Density,MeltingPointKelvin,BoilingPointKelvin,Isotopes,Discoverer,YearOfDiscovery,SpecificHeatCapacity,ElectronConfiguration,DisplayRow,DisplayColumn,Facts
1,Hydrogen,H,1.00794,1,1,Gas,,Nonmetal,0.012,0.79,2.2,13.5984,"+1, -1",0.00008988,14.175,20.28,3,Henry Cavendish,1766,14.304,1s1,1,1,"Hydrogen is the lightest and most abundant element in the universe, making up about 75% of its elemental mass. It is a colorless, odorless gas that exists as H₂, a diatomic molecule. Hydrogen plays a crucial role in stars, where nuclear fusion reactions convert hydrogen into helium, releasing enormous amounts of energy. On Earth, hydrogen is primarily found in compounds like water (H₂O) and hydrocarbons. It is used in a wide range of industries, including fuel cells, and as a reducing agent in various chemical processes. Hydrogen is essential for life as a component of organic molecules, and it also holds potential as a clean energy source. Despite its abundance, hydrogen does not occur in its pure form naturally on Earth due to its lightness and tendency to combine with other elements."
2,Helium,He,4.002602,1,18,Gas,,Noble gas,,0.49,,24.5874,0,0.0001785,,4.22,5,"Norman Lockyer, Pierre Janssen",1868,5.193,1s2,1,18,"Helium is the second lightest element and is a colorless, odorless, non-reactive gas. It is most well-known for being used in balloons, but it is also crucial in many scientific and industrial applications, such as cryogenics, where it is used to cool superconducting magnets. Helium is the second most abundant element in the universe, but on Earth, it is relatively rare and is mostly extracted from natural gas fields. Helium is the product of the fusion of hydrogen atoms in stars and does not react with other elements due to its stable electron configuration. It has the lowest boiling point of any element, making it invaluable for applications requiring extremely low temperatures. Helium is non-toxic, non-flammable, and lighter than air, making it safer than hydrogen in applications like ballooning."
3,Lithium,Li,6.941,2,1,Solid,bcc,Alkali metal,0.76,2.1,0.98,5.3917,1,0.534,453.85,1615,5,Johan August Arfwedson,1817,3.582,[He]2s1,2,1,"Lithium is a soft, silvery-white alkali metal that is highly reactive, especially in water. It is the lightest metal and has a variety of important uses, particularly in rechargeable lithium-ion batteries, which power everything from smartphones to electric vehicles. Lithium is also used in medicine, particularly for the treatment of bipolar disorder, as it helps stabilize mood. The element is highly reactive and must be stored under oil to prevent it from reacting with moisture in the air. Lithium compounds are also used in the production of heat-resistant glass, ceramics, and lubricants. It is primarily obtained from lithium-rich minerals like spodumene and from salt lakes in regions like South America. Lithium is crucial to modern technology, especially in energy storage and electric transportation."
4,Beryllium,Be,9.012182,2,2,Solid,hex,Alkaline earth metal,0.35,1.4,1.57,9.3227,2,1.85,1560.15,2742,6,Louis Nicolas Vauquelin,1798,1.825,[He]2s2,2,2,"Beryllium is a hard, grayish metal that is lightweight and has a high melting point. It is primarily used in aerospace applications, where its strength and lightness are critical. Beryllium alloys are often used in aircraft, satellites, and missiles. The element is toxic and must be handled with care, as inhaling beryllium dust can cause chronic beryllium disease. Despite its toxicity, beryllium is valued in manufacturing for its ability to withstand extreme temperatures and its excellent electrical conductivity. It is used in nuclear reactors as a moderator and in X-ray windows due to its transparency to X-rays. Beryllium was first discovered in the 18th century, but its applications in high-tech industries have made it more prominent in the modern era."
5,Boron,B,10.811,2,13,Solid,rho,Metalloid,0.23,1.2,2.04,8.298,3,2.34,2573.15,4200,6,"Humphry Davy, Joseph Louis Gay-Lussac, Louis Jacques Thénard",1808,1.026,[He]2s2 2p1,2,13,"Boron is a metalloid that occurs naturally in compounds like borax. It is used in the production of glass and ceramics, where it improves the durability and resistance to thermal shock. Boron compounds are also important in agriculture, acting as micronutrients for plants. The element has several industrial applications, including as a dopant in semiconductors and as a neutron absorber in nuclear reactors. Boron is unique for its ability to form strong covalent bonds and has an important role in the creation of complex materials such as boron nitride, which is used as a lubricant and in heat-resistant products. Boron is also found in the human body, albeit in trace amounts, and is believed to play a role in bone health and cognitive function."
6,Carbon,C,12.0107,2,14,Solid,hex,Nonmetal,,0.91,2.55,11.2603,"+4, +2, -4",2.267,3948.15,4300,7,Prehistoric,,0.709,[He]2s2 2p2,2,14,"Carbon is a non-metal element that forms the backbone of all known life forms. It is found in various forms, including diamond, graphite, and graphene, each of which has unique properties. Carbon’s ability to form four covalent bonds makes it highly versatile in forming complex molecules like proteins, lipids, and carbohydrates. In the natural world, carbon exists as a part of carbon dioxide (CO₂), a greenhouse gas that plays a key role in regulating Earth’s climate. Carbon is also essential in the energy sector, particularly in fossil fuels like coal, oil, and natural gas. The carbon cycle, in which carbon is exchanged between the atmosphere, oceans, and living organisms, is a vital process for life on Earth. The element is used in a variety of applications, including in the manufacture of steel, and in modern technology such as carbon fiber."
7,Nitrogen,N,14.0067,2,15,Gas,,Nonmetal,0.13,0.75,3.04,14.5341,"+5, +4, +3, +2, +1, -1, -2, -3",0.0012506,63.29,77.36,8,Daniel Rutherford,1772,1.04,[He] 2s2 2p3,2,15,"Nitrogen is a colorless, odorless gas that makes up about 78% of Earth’s atmosphere. It is an inert gas under standard conditions and is essential for life, as it is a component of amino acids and nucleic acids, which are the building blocks of proteins and DNA. Nitrogen is used in the production of fertilizers, explosives (such as TNT), and as a coolant in its liquid form. It is also used in the preservation of food and in creating an inert atmosphere for chemical reactions. Nitrogen fixation, the process of converting atmospheric nitrogen into a usable form for plants, is carried out by bacteria and is vital for agriculture. While nitrogen gas is inert, nitrogen compounds like nitrous oxide and ammonia are highly reactive and have significant chemical and environmental impacts."
8,Oxygen,O,15.9994,2,16,Gas,,Nonmetal,1.4,0.65,3.44,13.6181,-2,0.001429,50.5,90.2,8,"Joseph Priestley, Carl Wilhelm Scheele",1774,0.918,[He]2s2 2p4,2,16,"Oxygen is a colorless, odorless gas that is essential for life on Earth, as it is used by most organisms for cellular respiration. It makes up about 21% of Earth's atmosphere and is the most abundant element in the Earth's crust, forming compounds like water and various minerals. Oxygen is highly reactive and readily forms oxides with most elements. It is used in a variety of industrial processes, including steel manufacturing, welding, and medical applications, where pure oxygen is supplied to patients with respiratory conditions. Oxygen is also involved in the formation of ozone (O₃) in the upper atmosphere, which protects the Earth from harmful ultraviolet radiation. The element plays a crucial role in combustion, respiration, and many other natural and industrial processes."
9,Fluorine,F,18.9984032,2,17,Gas,,Halogen,1.3,0.57,3.98,17.4228,-1,0.001696,53.63,85.03,6,Henri Moissan,1886,0.824,[He]2s2 2p5,2,17,"Fluorine is a pale yellow, highly reactive gas that is the most electronegative and reactive of all elements. It is found in compounds like sodium fluoride, which is used in toothpaste, and in Teflon, a non-stick coating. Fluorine is highly corrosive and must be handled with extreme care. It is used in the production of various chemicals, including pharmaceuticals and refrigerants, and in the enrichment of uranium for nuclear reactors. Fluorine is also present in nature in mineral deposits, such as fluorite. Its reactivity makes it an important element in chemistry, especially in forming compounds with nearly every other element. While essential for human health in small quantities (in preventing dental cavities), excessive exposure to fluorine can be harmful."
10,Neon,Ne,20.1797,2,18,Gas,,Noble gas,,0.51,,21.5645,0,0.0008999,24.703,27.07,8,"William Ramsay, Morris Travers",1898,1.03,[He]2s2 2p6,2,18,"Neon is a colorless, odorless, inert gas that glows brightly when an electric current passes through it, making it famous for its use in neon signs. It is one of the noble gases and is found in trace amounts in the Earth's atmosphere. Neon has no significant chemical reactivity due to its stable electron configuration, which makes it useful in applications requiring an inert atmosphere. It is also used in high-voltage indicators, vacuum tubes, and as a cryogenic refrigerant. Neon is extracted from the atmosphere through a process of fractional distillation, and despite being rare, it is highly valued in signage and lighting applications. Neon’s distinctive red-orange glow is caused by the excitation of neon atoms in a discharge tube."
11,Sodium,Na,22.98976928,3,1,Solid,bcc,Alkali metal,1,2.2,0.93,5.1391,1,0.971,371.15,1156,7,Humphry Davy,1807,1.228,[Ne]3s1,3,1,"Sodium is a soft, silvery-white metal that reacts vigorously with water, producing hydrogen gas and heat. It is one of the alkali metals and is essential for life, as it helps regulate blood pressure and fluid balance in organisms. Sodium is commonly found in compounds like sodium chloride (table salt), which is vital for human diet and in industrial processes. Sodium is used in the production of glass, soap, and in chemical manufacturing. It also plays a key role in processes like electrolysis, where it is involved in producing chlorine and sodium hydroxide. Sodium vapor lamps, which emit a characteristic yellow light, are widely used for street lighting. Sodium is extracted from natural minerals such as rock salt and is abundant in seawater."
12,Magnesium,Mg,24.305,3,2,Solid,hex,Alkaline earth metal,0.72,1.7,1.31,7.6462,2,1.738,923.15,1363,8,"Humphry Davy, Joseph Black",1755,1.023,[Ne]3s2,3,2,"Magnesium is a silvery-white metal that is essential for life, as it plays a key role in hundreds of biochemical reactions, including muscle function, nerve transmission, and energy production. It is the eighth most abundant element in the Earth's crust and is commonly found in minerals like dolomite and magnesite. Magnesium alloys are used in the aerospace and automotive industries due to their lightweight properties. Magnesium is also used in the production of fireworks and flares, as it burns with a bright white light. Magnesium compounds, such as Epsom salt (magnesium sulfate), are commonly used in medicine for their laxative and muscle-relaxing properties. It is also used in fertilizers to improve soil quality."
13,Aluminum,Al,26.9815386,3,13,Solid,fcc,Post-transition metal,0.54,1.8,1.61,5.9858,3,2.698,933.4,2792,8,Hans Christian Ørsted,1827,0.897,[Ne]3s2 3p1,3,13,"Aluminum is a lightweight, silvery metal that is the most abundant metal in Earth's crust. It is highly versatile and is used in a wide variety of applications, including aerospace, transportation, construction, and packaging (especially in aluminum foil and cans). Aluminum is resistant to corrosion, which makes it ideal for outdoor and marine applications. It is a good conductor of heat and electricity and is also used in electrical transmission lines. Despite being a reactive metal, aluminum naturally forms a protective oxide layer that prevents further corrosion. Aluminum is also used in the production of lightweight alloys that are used in cars, airplanes, and other machinery to improve fuel efficiency. Recycling aluminum is highly efficient and saves energy, making it an environmentally-friendly material."
14,Silicon,Si,28.0855,3,14,Solid,fcc,Metalloid,0.4,1.5,1.9,8.1517,"+4, +2, -4",2.3296,1683.15,3538,8,Jöns Jacob Berzelius,1824,0.705,[Ne]3s2 3p2,3,14,"Silicon is a hard, brittle metal that is widely used in electronics and semiconductors due to its excellent ability to conduct electricity. It is the second most abundant element in the Earth's crust, and it forms the basis of most modern technology, from computers and smartphones to solar panels. Silicon is a key component in the production of integrated circuits (ICs), microchips, and transistors, which are the backbone of the electronics industry. It also plays a major role in the construction industry, where it is found in sand, clay, and stone, which are used to make concrete and glass. Silicon dioxide (SiO₂), or silica, is one of the most common compounds of silicon and is found in nature as quartz, used in everything from glass to gemstones. Silicon’s widespread use in high-tech applications has made it one of the most important elements in modern society."
15,Phosphorus,P,30.973762,3,15,Solid,cub,Nonmetal,0.38,1.2,2.19,10.4867,"+5, +3, -3",1.82,317.25,553,7,Hennig Brand,1669,0.769,[Ne]3s2 3p3,3,15,"Phosphorus is a non-metal element that is vital for life, as it is a key component of DNA, RNA, and ATP, all of which are essential for cellular function. It exists in several allotropes, with white phosphorus being the most reactive and red phosphorus being more stable. Phosphorus compounds, such as phosphates, are commonly found in fertilizers, as they are essential for plant growth. Phosphorus also plays a role in the formation of bones and teeth in animals. It is commonly used in the manufacture of safety matches, detergents, and flame retardants. In nature, phosphorus is found mainly in phosphate rock, which is mined for agricultural use. Its high reactivity makes white phosphorus dangerous to handle, as it can ignite spontaneously in air."
16,Sulfur,S,32.065,3,16,Solid,orth,Nonmetal,0.37,1.1,2.58,10.36,"+6, +4, -2",2.067,388.51,717.8,10,Prehistoric,,0.71,[Ne]3s2 3p4,3,16,"Sulfur is a yellow, non-metal element that has been known since ancient times for its use in medicine and as a component in gunpowder. It is essential for life, as sulfur-containing amino acids like cysteine and methionine are crucial for protein structure and function. Sulfur compounds, like sulfur dioxide, are used in the production of sulfuric acid, which is one of the most widely used industrial chemicals. Sulfur is also a key component of natural gas and petroleum and is involved in the formation of volcanic gases. In the environment, sulfur is part of the biogeochemical sulfur cycle, which includes processes like the formation of acid rain. Sulfur is commonly found in minerals such as pyrite (fool’s gold) and is also a major component of some natural ores."
17,Chlorine,Cl,35.453,3,17,Gas,,Halogen,1.8,0.97,3.16,12.9676,"+7, +5, +1, -1",0.003214,172.31,239.11,11,Carl Wilhelm Scheele,1774,0.479,[Ne]3s2 3p5,3,17,"Chlorine is a greenish-yellow gas with a strong odor that is highly reactive and toxic. It is commonly used as a disinfectant and in the production of a wide range of chemicals, including PVC (polyvinyl chloride), solvents, and pesticides. Chlorine is a halogen and is highly electronegative, readily forming salts with metals such as sodium chloride (table salt). It is used in water treatment to kill harmful bacteria and pathogens. Chlorine gas has been historically used as a chemical weapon, particularly during World War I, due to its toxic properties. In nature, chlorine is found in seawater, where it is present as chloride ions. Chlorine is an essential element for life in trace amounts but must be handled with care due to its toxicity and reactivity."
18,Argon,Ar,39.948,3,18,Gas,,Noble gas,,0.88,,15.7596,0,0.0017837,83.96,87.3,8,"John William Strutt, 3rd Baron Rayleigh, William Ramsay",1894,0.52,[Ne]3s2 3p6,3,18,"Argon is a colorless, odorless, inert gas that makes up about 1% of the Earth's atmosphere. It is one of the noble gases and is chemically inert, meaning it does not readily react with other elements. Argon is commonly used in welding and metal fabrication as an inert gas to shield the weld area from contamination by air. It is also used in the production of light bulbs, where it prevents the filament from burning up. Argon is used in laboratories as a non-reactive atmosphere for experiments involving highly reactive chemicals. Despite its low reactivity, argon is also a trace element in the atmosphere and is commonly found in volcanic gases and natural gas deposits. Argon’s lack of reactivity makes it ideal for applications where other gases might interfere with processes."
19,Potassium,K,39.0983,4,1,Solid,bcc,Alkali metal,1.4,2.8,0.82,4.3407,1,0.862,336.5,1032,10,Humphry Davy,1807,0.757,[Ar]4s1,4,1,"Potassium is a soft, silvery metal that is highly reactive, particularly with water. It is one of the alkali metals and is essential for life, as it plays a key role in maintaining the proper function of cells, nerves, and muscles. Potassium is involved in the regulation of blood pressure, heart function, and fluid balance. It is commonly found in salts such as potassium chloride, which is used in fertilizers, as well as in the production of soap and glass. Potassium compounds are also used in the manufacture of fireworks and as a source of nutrients in agriculture. In nature, potassium is primarily found in minerals like feldspar and in seawater. Its reactivity with water is so strong that it can cause fires or explosions when exposed to moisture."
20,Calcium,Ca,40.078,4,2,Solid,fcc,Alkaline earth metal,0.99,2.2,1,6.1132,2,1.54,1112.15,1757,14,Humphry Davy,1808,0.647,[Ar]4s2,4,2,"Calcium is a silvery-white alkaline earth metal that is vital for the health of bones and teeth, as it is a major component of their structure. It is also crucial for muscle function, nerve transmission, and blood clotting. Calcium is the fifth most abundant element in Earth’s crust and is commonly found in minerals like limestone, gypsum, and fluorite. Calcium compounds, such as calcium carbonate, are used in the construction industry in cement and lime, and as a dietary supplement to prevent bone diseases like osteoporosis. Calcium also plays a role in regulating cellular processes and is involved in signal transduction pathways. It is used in the production of metals and alloys, including steel, where it is added to remove impurities."
21,Scandium,Sc,44.955912,4,3,Solid,hex,Transition metal,0.75,2.1,1.36,6.5615,3,2.989,1812.15,3109,15,"Per Teodor Cleve, Lars Fredrik Nilson",1878,0.568,[Ar]4s2 3d1,4,3,"Scandium is a soft, silvery-white metal that is often classified as a transition metal. It is rare in the Earth's crust and is primarily found in ores such as thortveitite. Scandium is used in aerospace applications, as it improves the strength and lightness of aluminum alloys. Scandium alloys are particularly important in high-performance equipment, including aircraft and sports equipment like baseball bats. Although it is not abundant, scandium has promising potential for hydrogen storage applications, as its compounds can absorb large amounts of hydrogen. Scandium is also used in certain lighting applications, such as high-intensity discharge lamps, where it improves the quality of light. Due to its scarcity and limited applications, scandium remains one of the least economically significant transition metals."
22,Titanium,Ti,47.867,4,4,Solid,hex,Transition metal,0.61,2,1.54,6.8281,"+4, +3, +2",4.54,1933.15,3560,9,William Gregor,1791,0.523,[Ar]4s2 3d2,4,4,"Titanium is a strong, lightweight, and corrosion-resistant metal that is widely used in industries such as aerospace, medicine, and automotive. It is known for its high strength-to-weight ratio, which makes it ideal for use in aircraft, spacecraft, and military applications. Titanium alloys are used in implants, such as hip replacements and dental implants, due to their biocompatibility. The metal is resistant to corrosion, including from seawater and chlorine, which makes it useful in chemical processing and desalination plants. Titanium is also used in the production of high-performance sporting equipment, jewelry, and military armor. It is extracted from ores like rutile and ilmenite, and its extraction process is energy-intensive, which makes titanium products expensive."
23,Vanadium,V,50.9415,4,5,Solid,bcc,Transition metal,0.59,1.9,1.63,6.7462,"+5, +4, +3, +2",6.11,2175.15,3680,9,Andrés Manuel del Río,1801,0.489,[Ar]4s2 3d3,4,5,"Vanadium is a hard, silvery-gray metal that is used primarily in the production of high-strength steel alloys. Vanadium alloys are particularly valuable in the aerospace industry, where they are used to make lightweight, high-strength materials for aircraft and rockets. It is also used in the manufacture of batteries, such as vanadium redox flow batteries, which are a promising technology for energy storage. Vanadium is used in the production of tools, springs, and gears due to its hardness and resistance to wear. Despite its widespread industrial applications, vanadium is relatively rare in Earth's crust and must be extracted from minerals like vanadinite and magnetite. Vanadium compounds are also used as catalysts in chemical processes and to stabilize other metals."
24,Chromium,Cr,51.9961,4,6,Solid,bcc,Transition metal,0.52,1.9,1.66,6.7665,"+6, +3, +2",7.15,2130.15,2944,9,Louis Nicolas Vauquelin,1797,0.449,[Ar]3d5 4s1,4,6,"Chromium is a shiny, hard metal that is most commonly used in the production of stainless steel, where it imparts resistance to corrosion and enhances strength. It is also used to create alloys for various industrial purposes, such as in the production of tools and machinery. Chromium is a key component in chrome plating, which is used to give a shiny, corrosion-resistant finish to metal objects like car parts and faucets. It is an essential trace element for humans, involved in insulin regulation, but excessive exposure to chromium compounds can be toxic. Chromium also plays a role in the production of dyes and pigments, such as chromium oxide, which is used to make green and yellow colors in paints. The element is primarily obtained from ores like chromite, and its compounds are used as catalysts in industrial chemical processes."
25,Manganese,Mn,54.938045,4,7,Solid,bcc,Transition metal,0.46,1.8,1.55,7.434,"+7, +4, +3, +2",7.44,1519.15,2334,11,"Carl Wilhelm Scheele, Johan Gottlieb Gahn, Ignatius Gottfried Kaim",1774,0.479,[Ar]4s2 3d5,4,7,"Manganese is a grayish-white metal that is commonly used as an alloying element to strengthen steel and improve its hardness, toughness, and wear resistance. It is also used in the production of dry cell batteries, fertilizers, and in the chemical industry as a catalyst. Manganese is an essential trace element for human health, playing a role in the metabolism of amino acids, cholesterol, and glucose. The element is found in minerals like pyrolusite and is extracted through mining operations. Manganese is also used in the production of pigments and is an important component in the production of aluminum and brass alloys. While it is necessary for health in small amounts, excessive manganese exposure can lead to neurological damage, a condition known as manganism."
26,Iron,Fe,55.845,4,8,Solid,bcc,Transition metal,0.65,1.7,1.83,7.9024,"+3, +2",7.874,1808.15,3134,10,Prehistoric,,0.449,[Ar]4s2 3d6,4,8,"Iron is one of the most widely used metals in the world, known for its strength and versatility. It is a crucial component of steel, which is used in everything from construction to transportation. Iron is also important for biological systems, as it is a key component of hemoglobin, the molecule in red blood cells that carries oxygen throughout the body. Iron is extracted from ores like hematite and magnetite and is smelted in blast furnaces to produce pig iron, which is further refined to produce steel. Iron is highly reactive and forms compounds such as iron oxide (rust), which can corrode and weaken iron structures. Despite its susceptibility to corrosion, iron’s importance in the construction and manufacturing industries ensures that it remains one of the most economically significant elements."
27,Cobalt,Co,58.933195,4,9,Solid,hex,Transition metal,0.75,1.7,1.88,7.881,"+3, +2",8.86,1768.15,3200,14,Georg Brandt,1735,0.421,[Ar]4s2 3d7,4,9,"Cobalt is a hard, lustrous metal that is used primarily in the production of alloys, particularly those that are heat-resistant and durable. Cobalt-chromium alloys are used in the manufacture of medical implants, and cobalt is a key component in the production of superalloys used in jet engines and turbines. Cobalt is also a vital element in the manufacture of rechargeable batteries, such as those found in smartphones, laptops, and electric vehicles. Cobalt is an essential trace element in the human diet, as it is a component of vitamin B12, which is crucial for red blood cell production and neurological function. The element is primarily obtained as a by-product of nickel and copper mining. Cobalt’s use in batteries has led to concerns about the ethical sourcing of the metal, as much of it is mined in conflict zones, especially in the Democratic Republic of Congo."
